models/ticket-priority-dpo/checkpoint-6/trainer_state.json

{
  "best_global_step": null,
  "best_metric": null,
  "best_model_checkpoint": null,
  "epoch": 2.0,
  "eval_steps": 500,
  "global_step": 6,
  "is_hyper_param_search": false,
  "is_local_process_zero": true,
  "is_world_process_zero": true,
  "log_history": [
    {
      "epoch": 1.0,
      "eval_entropy": 3.9048749923706056,
      "eval_logits/chosen": 1.9260442733764649,
      "eval_logits/rejected": 1.914040732383728,
      "eval_logps/chosen": -17.12173728942871,
      "eval_logps/rejected": -18.12022285461426,
      "eval_loss": 0.6463567018508911,
      "eval_mean_token_accuracy": 0.0,
      "eval_num_tokens": 6080.0,
      "eval_rewards/accuracies": 1.0,
      "eval_rewards/chosen": 0.1017263412475586,
      "eval_rewards/margins": 0.09674682766199112,
      "eval_rewards/rejected": 0.004979513585567474,
      "eval_runtime": 1.4341,
      "eval_samples_per_second": 3.486,
      "eval_steps_per_second": 3.486,
      "step": 3
    },
    {
      "epoch": 2.0,
      "eval_entropy": 3.775387096405029,
      "eval_logits/chosen": 1.9303585529327392,
      "eval_logits/rejected": 1.8998143672943115,
      "eval_logps/chosen": -16.781482315063478,
      "eval_logps/rejected": -18.170340728759765,
      "eval_loss": 0.6277980208396912,
      "eval_mean_token_accuracy": 0.0,
      "eval_num_tokens": 12160.0,
      "eval_rewards/accuracies": 1.0,
      "eval_rewards/chosen": 0.13575184047222139,
      "eval_rewards/margins": 0.135784113407135,
      "eval_rewards/rejected": -3.2271444797515866e-05,
      "eval_runtime": 1.4136,
      "eval_samples_per_second": 3.537,
      "eval_steps_per_second": 3.537,
      "step": 6
    }
  ],
  "logging_steps": 10,
  "max_steps": 6,
  "num_input_tokens_seen": 0,
  "num_train_epochs": 2,
  "save_steps": 500,
  "stateful_callbacks": {
    "TrainerControl": {
      "args": {
        "should_epoch_stop": false,
        "should_evaluate": false,
        "should_log": false,
        "should_save": true,
        "should_training_stop": true
      },
      "attributes": {}
    }
  },
  "total_flos": 71498017013760.0,
  "train_batch_size": 1,
  "trial_name": null,
  "trial_params": null
}

README.md

### DPO Results:

[transformers] The tokenizer has new PAD/BOS/EOS tokens that differ from the model config and generation config. The model config and generation config were aligned accordingly, being updated with the tokenizer's values. Updated tokens: {'eos_token_id': 128009, 'pad_token_id': 128009}.
{'eval_loss': '0.6464', 'eval_runtime': '1.434', 'eval_samples_per_second': '3.486', 'eval_steps_per_second': '3.486', 'eval_entropy': '3.905', 'eval_num_tokens': '6080', 'eval_logits/chosen': '1.926', 'eval_logits/rejected': '1.914', 'eval_mean_token_accuracy': '0', 'eval_rewards/chosen': '0.1017', 'eval_rewards/rejected': '0.00498', 'eval_rewards/accuracies': '1', 'eval_rewards/margins': '0.09675', 'eval_logps/chosen': '-17.12', 'eval_logps/rejected': '-18.12', 'epoch': '1'}
{'eval_loss': '0.6278', 'eval_runtime': '1.414', 'eval_samples_per_second': '3.537', 'eval_steps_per_second': '3.537', 'eval_entropy': '3.775', 'eval_num_tokens': '1.216e+04', 'eval_logits/chosen': '1.93', 'eval_logits/rejected': '1.9', 'eval_mean_token_accuracy': '0', 'eval_rewards/chosen': '0.1358', 'eval_rewards/rejected': '-3.227e-05', 'eval_rewards/accuracies': '1', 'eval_rewards/margins': '0.1358', 'eval_logps/chosen': '-16.78', 'eval_logps/rejected': '-18.17', 'epoch': '2'}
{'train_runtime': '24.56', 'train_samples_per_second': '1.628', 'train_steps_per_second': '0.244', 'train_loss': '0.6802', 'epoch': '2'}