models/ticket-priority-sft/checkpoint-6/trainer_state.json

{
  "best_global_step": null,
  "best_metric": null,
  "best_model_checkpoint": null,
  "epoch": 2.0,
  "eval_steps": 500,
  "global_step": 6,
  "is_hyper_param_search": false,
  "is_local_process_zero": true,
  "is_world_process_zero": true,
  "log_history": [
    {
      "epoch": 1.0,
      "eval_entropy": 2.502981185913086,
      "eval_loss": 3.104034900665283,
      "eval_mean_token_accuracy": 0.47240626215934756,
      "eval_num_tokens": 3740.0,
      "eval_runtime": 0.593,
      "eval_samples_per_second": 8.431,
      "eval_steps_per_second": 8.431,
      "step": 3
    },
    {
      "epoch": 2.0,
      "eval_entropy": 2.5641952991485595,
      "eval_loss": 2.605591297149658,
      "eval_mean_token_accuracy": 0.5417548298835755,
      "eval_num_tokens": 7480.0,
      "eval_runtime": 0.5916,
      "eval_samples_per_second": 8.452,
      "eval_steps_per_second": 8.452,
      "step": 6
    }
  ],
  "logging_steps": 10,
  "max_steps": 9,
  "num_input_tokens_seen": 0,
  "num_train_epochs": 3,
  "save_steps": 500,
  "stateful_callbacks": {
    "TrainerControl": {
      "args": {
        "should_epoch_stop": false,
        "should_evaluate": false,
        "should_log": false,
        "should_save": true,
        "should_training_stop": false
      },
      "attributes": {}
    }
  },
  "total_flos": 43827742801920.0,
  "train_batch_size": 1,
  "trial_name": null,
  "trial_params": null
}

README.md

### SFT results:

The model config and generation config were aligned accordingly, being updated with the tokenizer's values. Updated tokens: {'eos_token_id': 128009, 'pad_token_id': 128009}.
- {'eval_loss': '3.104', 'eval_runtime': '0.593', 'eval_samples_per_second': '8.431', 'eval_steps_per_second': '8.431', 'eval_entropy': '2.503', 'eval_num_tokens': '3740', 'eval_mean_token_accuracy': '0.4724', 'epoch': '1'}                                                                                                                          
- {'eval_loss': '2.606', 'eval_runtime': '0.5916', 'eval_samples_per_second': '8.452', 'eval_steps_per_second': '8.452', 'eval_entropy': '2.564', 'eval_num_tokens': '7480', 'eval_mean_token_accuracy': '0.5418', 'epoch': '2'}                                                                                                                         
- {'eval_loss': '2.395', 'eval_runtime': '0.5749', 'eval_samples_per_second': '8.698', 'eval_steps_per_second': '8.698', 'eval_entropy': '2.467', 'eval_num_tokens': '1.122e+04', 'eval_mean_token_accuracy': '0.571', 'epoch': '3'}                                                                                                                    
**Final Cross Entropy Loss: 2.395**